{
  "analysis": {
    "cyclicComponents": [],
    "edgeCount": 50,
    "isDirectedAcyclic": true,
    "nodeCount": 64,
    "nonterminalComponentPolicy": "every expansion is bounded by explicit edge progress, validity, cadence, material exposure and story cap",
    "strongComponentCount": 64
  },
  "edges": [
    {
      "edgeClass": "non-closing",
      "episodeTruthEffect": "none",
      "fromBeatId": "stream.started",
      "guardProfileId": "current_confirmed_practice_occurrence",
      "id": "stream.started->session.intro.practice",
      "ordinal": 1,
      "preference": "preferred",
      "scoreBonus": 6,
      "toBeatId": "session.intro.practice"
    },
    {
      "edgeClass": "non-closing",
      "episodeTruthEffect": "none",
      "fromBeatId": "stream.started",
      "guardProfileId": "current_confirmed_qualifying_occurrence",
      "id": "stream.started->session.intro.qualifying",
      "ordinal": 2,
      "preference": "preferred",
      "scoreBonus": 6,
      "toBeatId": "session.intro.qualifying"
    },
    {
      "edgeClass": "non-closing",
      "episodeTruthEffect": "none",
      "fromBeatId": "stream.started",
      "guardProfileId": "current_confirmed_race_occurrence",
      "id": "stream.started->session.intro.race",
      "ordinal": 3,
      "preference": "preferred",
      "scoreBonus": 6,
      "toBeatId": "session.intro.race"
    },
    {
      "edgeClass": "non-closing",
      "episodeTruthEffect": "none",
      "fromBeatId": "timing.lap.hot",
      "guardProfileId": "same_attempt_revision_projection_valid",
      "id": "timing.lap.hot->timing.lap.projected",
      "ordinal": 4,
      "preference": "preferred",
      "scoreBonus": 6,
      "toBeatId": "timing.lap.projected"
    },
    {
      "edgeClass": "non-closing",
      "episodeTruthEffect": "none",
      "fromBeatId": "timing.lap.hot",
      "guardProfileId": "same_attempt_target_valid",
      "id": "timing.lap.hot->timing.target.locked",
      "ordinal": 5,
      "preference": "allowed",
      "scoreBonus": 0,
      "toBeatId": "timing.target.locked"
    },
    {
      "edgeClass": "non-closing",
      "episodeTruthEffect": "none",
      "fromBeatId": "timing.lap.projected",
      "guardProfileId": "same_attempt_qualifying_position_target",
      "id": "timing.lap.projected->timing.position.attack",
      "ordinal": 6,
      "preference": "preferred",
      "scoreBonus": 6,
      "toBeatId": "timing.position.attack"
    },
    {
      "edgeClass": "non-closing",
      "episodeTruthEffect": "none",
      "fromBeatId": "timing.target.locked",
      "guardProfileId": "same_attempt_material_gain",
      "id": "timing.target.locked->timing.pace.gain",
      "ordinal": 7,
      "preference": "allowed",
      "scoreBonus": 0,
      "toBeatId": "timing.pace.gain"
    },
    {
      "edgeClass": "non-closing",
      "episodeTruthEffect": "none",
      "fromBeatId": "timing.target.locked",
      "guardProfileId": "same_attempt_material_loss",
      "id": "timing.target.locked->timing.pace.loss",
      "ordinal": 8,
      "preference": "allowed",
      "scoreBonus": 0,
      "toBeatId": "timing.pace.loss"
    },
    {
      "edgeClass": "non-closing",
      "episodeTruthEffect": "none",
      "fromBeatId": "timing.sector.split",
      "guardProfileId": "same_sector_result_explicitly_best",
      "id": "timing.sector.split->timing.sector.best",
      "ordinal": 9,
      "preference": "preferred",
      "scoreBonus": 6,
      "toBeatId": "timing.sector.best"
    },
    {
      "edgeClass": "closing",
      "episodeTruthEffect": "none",
      "fromBeatId": "timing.lap.projected",
      "guardProfileId": "same_lap_completed",
      "id": "timing.lap.projected->timing.lap.completed",
      "ordinal": 10,
      "preference": "preferred",
      "scoreBonus": 6,
      "toBeatId": "timing.lap.completed"
    },
    {
      "edgeClass": "closing",
      "episodeTruthEffect": "none",
      "fromBeatId": "timing.target.locked",
      "guardProfileId": "same_lap_completed",
      "id": "timing.target.locked->timing.lap.completed",
      "ordinal": 11,
      "preference": "allowed",
      "scoreBonus": 0,
      "toBeatId": "timing.lap.completed"
    },
    {
      "edgeClass": "closing",
      "episodeTruthEffect": "none",
      "fromBeatId": "timing.lap.hot",
      "guardProfileId": "same_attempt_invalidated",
      "id": "timing.lap.hot->incident.invalid_lap",
      "ordinal": 12,
      "preference": "preferred",
      "scoreBonus": 6,
      "toBeatId": "incident.invalid_lap"
    },
    {
      "edgeClass": "non-closing",
      "episodeTruthEffect": "none",
      "fromBeatId": "battle.pursuit",
      "guardProfileId": "same_target_relation_approach_claims_true",
      "id": "battle.pursuit->battle.approach",
      "ordinal": 13,
      "preference": "preferred",
      "scoreBonus": 6,
      "toBeatId": "battle.approach"
    },
    {
      "edgeClass": "non-closing",
      "episodeTruthEffect": "none",
      "fromBeatId": "battle.pursuit",
      "guardProfileId": "same_front_relation_plus_valid_rear_relation",
      "id": "battle.pursuit->battle.two_front",
      "ordinal": 14,
      "preference": "allowed",
      "scoreBonus": 0,
      "toBeatId": "battle.two_front"
    },
    {
      "edgeClass": "non-closing",
      "episodeTruthEffect": "none",
      "fromBeatId": "battle.approach",
      "guardProfileId": "same_target_relation_attack_band_true",
      "id": "battle.approach->battle.attack_range",
      "ordinal": 15,
      "preference": "preferred",
      "scoreBonus": 6,
      "toBeatId": "battle.attack_range"
    },
    {
      "edgeClass": "non-closing",
      "episodeTruthEffect": "none",
      "fromBeatId": "battle.attack_range",
      "guardProfileId": "same_target_relation_overlap_true",
      "id": "battle.attack_range->battle.side_by_side",
      "ordinal": 16,
      "preference": "preferred",
      "scoreBonus": 6,
      "toBeatId": "battle.side_by_side"
    },
    {
      "edgeClass": "closing",
      "episodeTruthEffect": "none",
      "fromBeatId": "battle.pursuit",
      "guardProfileId": "same_target_ordered_pass_result",
      "id": "battle.pursuit->position.pass",
      "ordinal": 17,
      "preference": "allowed",
      "scoreBonus": 0,
      "toBeatId": "position.pass"
    },
    {
      "edgeClass": "closing",
      "episodeTruthEffect": "none",
      "fromBeatId": "battle.approach",
      "guardProfileId": "same_target_ordered_pass_result",
      "id": "battle.approach->position.pass",
      "ordinal": 18,
      "preference": "preferred",
      "scoreBonus": 6,
      "toBeatId": "position.pass"
    },
    {
      "edgeClass": "closing",
      "episodeTruthEffect": "none",
      "fromBeatId": "battle.attack_range",
      "guardProfileId": "same_target_ordered_pass_result",
      "id": "battle.attack_range->position.pass",
      "ordinal": 19,
      "preference": "preferred",
      "scoreBonus": 6,
      "toBeatId": "position.pass"
    },
    {
      "edgeClass": "closing",
      "episodeTruthEffect": "none",
      "fromBeatId": "battle.side_by_side",
      "guardProfileId": "same_target_ordered_pass_result",
      "id": "battle.side_by_side->position.pass",
      "ordinal": 20,
      "preference": "preferred",
      "scoreBonus": 6,
      "toBeatId": "position.pass"
    },
    {
      "edgeClass": "closing",
      "episodeTruthEffect": "none",
      "fromBeatId": "battle.side_by_side",
      "guardProfileId": "same_target_battle_outcome_without_pass_claim",
      "id": "battle.side_by_side->battle.won",
      "ordinal": 21,
      "preference": "allowed",
      "scoreBonus": 0,
      "toBeatId": "battle.won"
    },
    {
      "edgeClass": "non-closing",
      "episodeTruthEffect": "none",
      "fromBeatId": "battle.pressure_behind",
      "guardProfileId": "same_rear_target_relation_threat_claims_true",
      "id": "battle.pressure_behind->battle.rival_threat",
      "ordinal": 22,
      "preference": "preferred",
      "scoreBonus": 6,
      "toBeatId": "battle.rival_threat"
    },
    {
      "edgeClass": "non-closing",
      "episodeTruthEffect": "none",
      "fromBeatId": "battle.pressure_behind",
      "guardProfileId": "same_rear_relation_plus_valid_front_relation",
      "id": "battle.pressure_behind->battle.two_front",
      "ordinal": 23,
      "preference": "allowed",
      "scoreBonus": 0,
      "toBeatId": "battle.two_front"
    },
    {
      "edgeClass": "closing",
      "episodeTruthEffect": "none",
      "fromBeatId": "battle.rival_threat",
      "guardProfileId": "correlated_position_loss_result",
      "id": "battle.rival_threat->position.lost",
      "ordinal": 24,
      "preference": "preferred",
      "scoreBonus": 6,
      "toBeatId": "position.lost"
    },
    {
      "edgeClass": "non-closing",
      "episodeTruthEffect": "none",
      "fromBeatId": "battle.two_front",
      "guardProfileId": "one_declared_relation_becomes_overlap",
      "id": "battle.two_front->battle.side_by_side",
      "ordinal": 25,
      "preference": "allowed",
      "scoreBonus": 0,
      "toBeatId": "battle.side_by_side"
    },
    {
      "edgeClass": "closing",
      "episodeTruthEffect": "none",
      "fromBeatId": "battle.two_front",
      "guardProfileId": "correlated_front_relation_result",
      "id": "battle.two_front->position.pass",
      "ordinal": 26,
      "preference": "allowed",
      "scoreBonus": 0,
      "toBeatId": "position.pass"
    },
    {
      "edgeClass": "closing",
      "episodeTruthEffect": "none",
      "fromBeatId": "battle.two_front",
      "guardProfileId": "correlated_rear_relation_result",
      "id": "battle.two_front->position.lost",
      "ordinal": 27,
      "preference": "allowed",
      "scoreBonus": 0,
      "toBeatId": "position.lost"
    },
    {
      "edgeClass": "non-closing",
      "episodeTruthEffect": "none",
      "fromBeatId": "pit.entry",
      "guardProfileId": "same_pit_cycle_lane_fact_active",
      "id": "pit.entry->pit.lane",
      "ordinal": 28,